{
  "schema": "custody-v1",
  "source_url": "https://cardanocube.com/projects/cns",
  "capture_date": "2026-06-03T08:30:00Z",
  "capture_method": "wayback-pin: availability/Save-Page-Now then curl -sL --user-agent \"cdo-preserve/1.0\" \"<wayback id_ url>\"; SHA-256 computed, bytes not stored",
  "capture_operator": "cryptoleo79",
  "capture_session_id": "2026-06-03T08:30:00Z-cardanocube-graveyard-taxonomy",
  "sha256": "850c7bea9569b9a76ed85f549ed39949af89e1fb9d4c4ca1fbbcfcb4366fc6d1",
  "content_type": "text/html",
  "http_status": 200,
  "source_authority_class": "D",
  "wayback_url": "https://web.archive.org/web/20260204042051id_/https://cardanocube.com/projects/cns",
  "bytes_stored": false,
  "notes": "cardanocube project page for 'cns', a project listed in /projects/graveyard (curator-declared dead). Preserved by wayback-pin: the editorial profile of a now-defunct Cardano project \u2014 exactly the perishable Project Memory content. bytes_stored:false."
}