{
  "schema": "custody-v1",
  "source_url": "https://taptools.io/charts",
  "capture_date": "2026-06-03T08:00:00Z",
  "capture_method": "curl -sfL --user-agent \"cdo-preserve/1.0\" \"https://web.archive.org/web/20220520221221id_/https://taptools.io/charts\"",
  "capture_operator": "cryptoleo79",
  "capture_session_id": "2026-06-03T08:00:00Z-taptools-rankings",
  "sha256": "17216cbd010975c2caf8f764b308804e851131ee95d5c1ecbec7edf1f54bc375",
  "content_type": "text/html",
  "http_status": 200,
  "source_authority_class": "C",
  "wayback_url": "https://web.archive.org/web/20220520221221id_/https://taptools.io/charts",
  "post_strip_applied": false,
  "bytes_stored": true,
  "notes": "Wayback raw (id_) snapshot of the TapTools charts ranking-grid root. Ranked-row signal count=10; content_bearing=True. Server-rendered ranking content present (pre-SPA era)."
}