{
  "schema": "custody-v1",
  "source_url": "https://cardanocube.com/projects/cerra-io",
  "capture_date": "2026-06-03T08:30:00Z",
  "capture_method": "wayback-pin: availability/Save-Page-Now then curl -sL --user-agent \"cdo-preserve/1.0\" \"<wayback id_ url>\"; SHA-256 computed, bytes not stored",
  "capture_operator": "cryptoleo79",
  "capture_session_id": "2026-06-03T08:30:00Z-cardanocube-graveyard-taxonomy",
  "sha256": "b9ac50e69a5192ea5293189c209e2d10852621a517fc3e5a091e8f483554e195",
  "content_type": "text/html",
  "http_status": 200,
  "source_authority_class": "D",
  "wayback_url": "https://web.archive.org/web/20260603133802id_/https://cardanocube.com/projects/cerra-io",
  "bytes_stored": false,
  "notes": "cardanocube project page for 'cerra-io', a project listed in /projects/graveyard (curator-declared dead). Preserved by wayback-pin: the editorial profile of a now-defunct Cardano project \u2014 exactly the perishable Project Memory content. bytes_stored:false."
}