{
  "schema": "custody-v1",
  "source_url": "https://taptools.gitbook.io/taptools",
  "capture_date": "2026-06-06T00:00:00Z",
  "capture_method": "wayback Save-Page-Now then curl -sL --user-agent \"cdo-preserve/1.0\" \"<wayback id_ url>\"; SHA-256 computed, bytes not stored",
  "capture_operator": "cryptoleo79",
  "capture_session_id": "2026-06-06T00:00:00Z-taptools-api-preservation",
  "sha256": "f38527b7a6b1166574de5c1d7cf6cddb5f91cb3c031920443c0dd950946b72c4",
  "content_type": "text/html",
  "http_status": 200,
  "source_authority_class": "C",
  "wayback_url": "https://web.archive.org/web/20260606063205id_/https://taptools.gitbook.io/taptools",
  "bytes_stored": false,
  "notes": "TapTools API documentation (GitBook). Pinned to the Wayback Machine ahead of the TapTools company wind-down (~mid-June 2026)."
}