{
  "schema": "custody-v1",
  "source_url": "https://cardanocube.com/projects/occamrazer",
  "capture_date": "2026-06-03T08:30:00Z",
  "capture_method": "wayback-pin: availability/SPN then curl -sL --user-agent \"cdo-preserve/1.0\" \"<wayback id_ url>\"; SHA-256 computed, bytes not stored",
  "capture_operator": "cryptoleo79",
  "capture_session_id": "2026-06-03T08:30:00Z-cardanocube-graveyard-taxonomy",
  "sha256": "e3983ebeba93e0b6f656e30e5ee8b75b008830484b587e7c66c08e6e34b15240",
  "content_type": "text/html",
  "http_status": 200,
  "source_authority_class": "D",
  "wayback_url": "https://web.archive.org/web/20240714113029id_/https://cardanocube.com/projects/occamrazer",
  "bytes_stored": false,
  "notes": "cardanocube project page for 'occamrazer', listed in /projects/graveyard (curator-declared dead). Wayback-pin of the editorial profile of a defunct Cardano project. bytes_stored:false."
}