{
  "schema": "custody-v1",
  "source_url": "https://builtoncardano.com/ecosystem/all",
  "capture_date": "2026-06-17T01:32:51Z",
  "capture_method": "direct fetch -A \"cdo-preserve/1.0\"; project link data parsed from the page __NEXT_DATA__; SHA-256 of fetched HTML computed, bytes not stored",
  "capture_operator": "cryptoleo79",
  "capture_session_id": "2026-06-17T01:32:51Z-builtoncardano-ecosystem-enrichment",
  "sha256": "dd16fb48d83fe5082f17f008132301112014d3af08b53713b633a34580ae53f2",
  "content_type": "text/html",
  "http_status": 200,
  "source_authority_class": "B",
  "wayback_url": "https://web.archive.org/web/20260211002257id_/https://builtoncardano.com/ecosystem/all",
  "bytes_stored": false,
  "notes": "Built on Cardano ecosystem directory listing. Used to enrich Project Memory with sourced project links (website/github/documentation/whitepaper). Audit links are not exposed by this source and were not added."
}
