{
  "schema": "custody-v1",
  "source_url": "https://www.taptools.io/charts",
  "capture_date": "2026-06-03T08:00:00Z",
  "capture_method": "curl -sfL --user-agent \"cdo-preserve/1.0\" \"https://web.archive.org/web/20230320101548id_/https://www.taptools.io/charts\"",
  "capture_operator": "cryptoleo79",
  "capture_session_id": "2026-06-03T08:00:00Z-taptools-rankings",
  "sha256": "95ea14877ba5e61808afe71ebb5fad4589ccc8ecaec143e09471d7536986feda",
  "content_type": "text/html",
  "http_status": 200,
  "source_authority_class": "C",
  "wayback_url": "https://web.archive.org/web/20230320101548id_/https://www.taptools.io/charts",
  "post_strip_applied": false,
  "bytes_stored": true,
  "notes": "Wayback raw (id_) snapshot of the TapTools charts ranking-grid root. Ranked-row signal count=0; content_bearing=False. Empty/near-empty SPA shell (post-SPA-conversion); preserved to document the date TapTools stopped server-rendering ranking state. No XHR-loaded data captured."
}