{
  "schema": "custody-v1",
  "source_url": "https://cardanocube.com/projects/pepeblue",
  "capture_date": "2026-06-03T08:30:00Z",
  "capture_method": "wayback-pin: availability/SPN then curl -sL --user-agent \"cdo-preserve/1.0\" \"<wayback id_ url>\"; SHA-256 computed, bytes not stored",
  "capture_operator": "cryptoleo79",
  "capture_session_id": "2026-06-03T08:30:00Z-cardanocube-graveyard-taxonomy",
  "sha256": "c6d3db08ba13c7084e543505bb2c0b4c64de0b02fdeedc2ebabf042995e5b3e6",
  "content_type": "text/html",
  "http_status": 200,
  "source_authority_class": "D",
  "wayback_url": "https://web.archive.org/web/20241204053033id_/https://cardanocube.com/projects/pepeblue",
  "bytes_stored": false,
  "notes": "cardanocube project page for 'pepeblue', listed in /projects/graveyard (curator-declared dead). Wayback-pin of the editorial profile of a defunct Cardano project. bytes_stored:false."
}