{
  "schema": "custody-v1",
  "source_url": "https://cardanocube.com/projects/virusx",
  "capture_date": "2026-06-03T08:30:00Z",
  "capture_method": "wayback-pin: availability/SPN then curl -sL --user-agent \"cdo-preserve/1.0\" \"<wayback id_ url>\"; SHA-256 computed, bytes not stored",
  "capture_operator": "cryptoleo79",
  "capture_session_id": "2026-06-03T08:30:00Z-cardanocube-graveyard-taxonomy",
  "sha256": "7e0ea52040e6630518f62e9f1c01a175ee41f936e3aee718c1916b08553647c2",
  "content_type": "text/html",
  "http_status": 200,
  "source_authority_class": "D",
  "wayback_url": "https://web.archive.org/web/20240722133646id_/https://cardanocube.com/projects/virusx",
  "bytes_stored": false,
  "notes": "cardanocube project page for 'virusx', listed in /projects/graveyard (curator-declared dead). Wayback-pin of the editorial profile of a defunct Cardano project. bytes_stored:false."
}