{
  "schema": "custody-v1",
  "source_url": "https://cardanocube.com/projects/charlz-token",
  "capture_date": "2026-06-03T08:30:00Z",
  "capture_method": "wayback-pin: availability/Save-Page-Now then curl -sL --user-agent \"cdo-preserve/1.0\" \"<wayback id_ url>\"; SHA-256 computed, bytes not stored",
  "capture_operator": "cryptoleo79",
  "capture_session_id": "2026-06-03T08:30:00Z-cardanocube-graveyard-taxonomy",
  "sha256": "233e745b5841d3e8f5201195d3a91118e37ba04876de166542c58e8e831c11a2",
  "content_type": "text/html",
  "http_status": 200,
  "source_authority_class": "D",
  "wayback_url": "https://web.archive.org/web/20250206121131id_/https://cardanocube.com/projects/charlz-token",
  "bytes_stored": false,
  "notes": "cardanocube project page for 'charlz-token', a project listed in /projects/graveyard (curator-declared dead). Preserved by wayback-pin: the editorial profile of a now-defunct Cardano project \u2014 exactly the perishable Project Memory content. bytes_stored:false."
}