{
  "schema": "custody-v1",
  "source_url": "https://cardanocube.com/projects/marketraker",
  "capture_date": "2026-06-03T08:30:00Z",
  "capture_method": "wayback-pin: availability/SPN then curl -sL --user-agent \"cdo-preserve/1.0\" \"<wayback id_ url>\"; SHA-256 computed, bytes not stored",
  "capture_operator": "cryptoleo79",
  "capture_session_id": "2026-06-03T08:30:00Z-cardanocube-graveyard-taxonomy",
  "sha256": "7bfcda478e5788f4dd89e598670ca868115fba6498e287dd2dd9f1c12b1715cc",
  "content_type": "text/html",
  "http_status": 200,
  "source_authority_class": "D",
  "wayback_url": "https://web.archive.org/web/20260603134312id_/https://cardanocube.com/projects/marketraker",
  "bytes_stored": false,
  "notes": "cardanocube project page for 'marketraker', listed in /projects/graveyard (curator-declared dead). Wayback-pin of the editorial profile of a defunct Cardano project. bytes_stored:false."
}